{
  "schemaVersion": 2,
  "cusaId": "CUSA08692",
  "title": "Dark Souls: Remastered",
  "region": "US",
  "publisher": "Bandai Namco Entertainment",
  "canonicalIssue": {
    "repository": "JICA98/Bachata-S4-Compatibility",
    "number": 101
  },
  "legacyIssues": [
    {
      "repository": "JICA98/Bachata-S4-Fork-Archive",
      "number": 3
    }
  ]
}
